{
  "$schema": "https://json-schema.org/draft/2020-12/schema", "$id": "kilix.content.retention-intent/v1", "type": "object", "additionalProperties": false,
  "required": ["schema", "kind", "version", "release_id", "intent_digest", "nonce", "authority_digest", "output_digest", "stable_slot_digest", "profile_digest", "release_schema_digest", "reservation_id", "expected_generation", "target_roles"],
  "properties": {"schema": {"const": "kilix.content.retention/v1"}, "kind": {"const": "intent"}, "version": {"type": "integer", "const": 1}, "release_id": {"type": "string", "pattern": "^[a-z0-9][a-z0-9._-]{0,63}$"}, "intent_digest": {"type": "string", "pattern": "^[0-9a-f]{64}$"}, "nonce": {"type": "string", "pattern": "^[0-9a-f]{64}$"}, "authority_digest": {"type": "string", "pattern": "^[0-9a-f]{64}$"}, "output_digest": {"type": "string", "pattern": "^[0-9a-f]{64}$"}, "stable_slot_digest": {"type": "string", "pattern": "^[0-9a-f]{64}$"}, "profile_digest": {"type": "string", "pattern": "^[0-9a-f]{64}$"}, "release_schema_digest": {"type": "string", "pattern": "^[0-9a-f]{64}$"}, "reservation_id": {"type": "string", "pattern": "^[a-z0-9][a-z0-9._-]{0,63}$"}, "expected_generation": {"type": "integer", "minimum": 1}, "target_roles": {"type": "array", "const": ["D", "M", "R", "P", "H"]}}
}
