{"authority_digest":"0000000000000000000000000000000000000000000000000000000000000010","expected_generation":1,"intent_digest":"0000000000000000000000000000000000000000000000000000000000000020","kind":"intent","nonce":"0000000000000000000000000000000000000000000000000000000000000021","output_digest":"0000000000000000000000000000000000000000000000000000000000000017","profile_digest":"0000000000000000000000000000000000000000000000000000000000000031","release_id":"release-0.2.1","release_schema_digest":"0000000000000000000000000000000000000000000000000000000000000032","reservation_id":"reservation-1","schema":"kilix.content.retention/v1","stable_slot_digest":"0000000000000000000000000000000000000000000000000000000000000033","target_roles":["D","M","R","P","H"],"version":1}
